course,review,stars,provider
Diploma in Medical Secretary - CPD Accredited,This is not a course. It is general information about a medical secretery's post. Irrelevent subjects to NHS. Doesn's show you even how the EMR looks like. Nothing about audio typing. Exams are written by a 9 years old. 400 pounds to read what a medical secretary does and 9 pound for a diploma I am assamed to even use it on CV. Its a joke.,1.0,one_education
Food Safety Level 2,£18 for print it yourself E certificate very poor.,2.6,one_education
Mental Health Care Training - MCA & DOLS - CPD Accredited,"A fantastic course, well structured, a must for people who work with People in the care industry.",5.0,one_education
Self Harm - Care Assistant Training - CPD Accredited,"A must do course for anyone working with people, at risk of self harm, excellent insight,",5.0,one_education
Executive Secretarial and PA Course,,5.0,one_education
"English: Spelling, Punctuation and Grammar - CPD Accredited","Do not waste your time or money. Very poorly put together, unreliable content, difficult to understand and your certificate price is not included.",1.6,one_education
Security Management Diploma - CPD Accredited,A very American-centric and IT-centric security course. If you are looking for something for the UK and physical security possibly not the one. Ok for information and may be useful if you work with a US client or company.,3.6,one_education
HR and Payroll Administrator Course - CPD Accredited,Very good structured and interesting,5.0,one_education
Child Psychology and Child Care Diploma - CPD Accredited,,4.0,one_education
Anti-Money Laundering (AML) Training Course Level 3 - CPD Accredited,"Although I totally enjoyed the course I found it too much focused on US regulation and none of European and UK regulation, which should be included as the course if for UK and global money laundering. Also in some units it refers too much on Money exchange business whereas financial institutions and their methods should be expanded.",4.3,one_education
Phlebotomist Training - CPD Accredited,"Only just purchased, so haven't finished yet working through at own pace as I have a yr to do so, so far so good very informative and I really like it. Once I get further along I could give a better review",4.3,one_education
Computer Hacking Forensic Investigator,,5.0,one_education
Customer Service Advisor Course,,5.0,one_education
Asbestos Awareness Course - CPD Accredited,"The course itself was great i took the mock test which i failed but passed the real one first time the mock was great as it gave me a idea of which questions will be asked, which helped me pass the proper test on the first try. I hated the fact i had to pa £9 for a digital copy of the certificate as other courses its free and its only the hard copy you pay for also you have o wait 24 hours for the copy to be generated but with others its instant.",4.0,one_education
Workplace Health and Safety Advanced Diploma - CPD Accredited,"A well outlined course, with pleenty of great content. I liked the way it covered both the UK and US - this provided a nice contrast and added value.",4.6,one_education
Feline and Canine Behaviour & Psychology Level 3 - CPD Accredited,"A good course but there are no evaluations to do, no quiz or final exam. im glad i only paid the £19 and not the £425.",5.0,one_education
Security Guard Training - CPD Accredited,,5.0,one_education
Security Guard Training - CPD Accredited,,5.0,one_education
Phlebotomist Training - CPD Accredited,There is additional fee for PDF Certificates (9) and for the hard one 18 or something like that.,4.3,one_education
"English: Spelling, Punctuation and Grammar - CPD Accredited",,5.0,one_education
Office Management and Administration Diploma -CPD Accredited,"Content lacking, videos not always significant and case studies can’t see the value.",2.6,one_education
Estate Agent Diploma Level 3 - CPD Accredited,,2.3,one_education
Photography for Beginners - CPD Accredited,"Since sending the above review, I immediately received the further details, I was complaining about not receiving. I'm unable to comment on the above items, Quality of service, Course content and Value for money as I've yet to receive any course content. As soon as I've started the course, I will gladly make those requested comments.",1.3,one_education
Freelance Barber Training - CPD Accredited,"I have hairdressing ladies/gents city &guilds and both in Hairdressing council -had 2 salons and mobile rounds, many trends have changes over the years and it was good to revise and learn new styles etc-great course even for those who are novices",5.0,one_education
Phlebotomist Training - CPD Accredited,"I have now found out from a nurse that this course is not valid apparently, could you please confirm what I can do with it ?",3.6,one_education
"English: Spelling, Punctuation and Grammar - CPD Accredited",Some of the content was missing. I think an extra 9 pounds is a lot for a pdf certificate which will take 2 - 4 weeks. No sign of free Microsoft Course.,2.6,one_education
120 hours TEFL (TESOL) Masterclass - CPD Accredited,,5.0,one_education
Retail Management - CPD Accredited,I’m on the last module of this course after four months and I’ve enjoyed it. It was supposed to take longer but I’ve been studying every day. Some of the content is repetitive and basic but I have learned a few new procedures and tools that I’d never heard of. My only problem is that I don’t know how it’s going to help me progress. You won’t get hired as management without experience or undergoing further training but it’s fun for someone who has no prior knowledge of retail management.,4.0,one_education
HR and Payroll Administrator Course - CPD Accredited,"Hi, I can't seem to purchase this course. Keeps reverting back to review page. What should i do?",3.6,one_education
Phlebotomist Training - CPD Accredited,"Do not buy this course, the quality is horrible.",1.0,one_education
"Admin, Secretarial and PA Diploma Level 3 - CPD Accredited",I had numerous problems with this. Had to ask for several items that were supposed to be there. There needs to be a way to download for look at course notes. Also free downloads of programs needed. Not everyone has those on their computer.,1.0,one_education
Learning and Development Diploma - CPD Accredited,"This is a good, simple introduction to Learning and Development. Manageable, but passive (read and tick), approach. Contact from One Education was prompt. Support is available too. Lacking attention to detail (errors in grammar and punctuation, some questions poorly worded, answers in tests marked incorrect when they were correct). OK for £17 (remember certificate is extra).",3.6,one_education
Housekeeping Training Course,,5.0,one_education
Legal Secretary and Office Skills Diploma - CPD Accredited,,1.6,one_education
Legal Secretary and Office Skills Diploma - CPD Accredited,"Lots to read, so a lot of good information, however, it isn’t interative so difficult to take things in. The only interaction is a quiz after you’ve read for 38 hours so it isn’t a good course to do if you can’t retain information just by reading it. Also, there are a lot of spelling mistakes throughout and it seems very Americanised.",3.6,one_education
Cleaning Business Management - CPD Accredited,"it is all a con,the content you can get elsewhere fro free",1.0,one_education
HR and Payroll Administrator Course - CPD Accredited,On another note they did evenly fix this problem but took several times asking. Also had issues with mock test not being there - had to ask or a video not being there.,2.0,one_education
"Admin, Secretarial and PA Diploma Level 3 - CPD Accredited","I am finding this course very interesting and easy to complete there is a constant link to immediate help and a chat forum at the bottom of the page so you never feel isolated, also you can easily see your progress and how long you have to complete it at the top of the page so there is no feeling of being rushed or panic that you do not have tome to do something. All in all, I could not be more impressed",5.0,one_education
Pastry Chef Training - CPD Accredited,,4.3,one_education
Retail Sales Assistant Course - CPD Accredited,,3.6,one_education
Workplace Health and Safety Advanced Diploma - CPD Accredited,"with the incorrect information and poor customer service this really wasn't worth the money. On completion of the course I purchased the PDF and hard copy certificate costing £22, only to find out they had charged me 3 times, after weeks of emails with no reply I call them, wasting another 30 minutes on the phone with someone who could not understand a word I said I've decided to call this a loss. Avoid",1.3,one_education
Office Receptionist Course - CPD Accredited,"The course itself was insightful and I did leave with something useful. Alot of the materials were repeated from one section to another. Some of the videos were not available and some do not link with section. Worst - exam queations. 30% was on Microsoft Office - not covered in material. Another 30-40% was on the case studies - 3 major sections 12 modules. Memory or test on what learnt from actual course. I hope this helps with maybe aligning course materials, exams to what should be?",2.3,one_education
Family Outreach Support Worker Training,I have left questions but have received no replies. I don't access the course daily but when I do are returned to thd beginning. There doesn't seem to be any structure. Or inform you of any progress,3.0,one_education
Car Mechanic Training - CPD Accredited,Very helpful,5.0,one_education
Paralegal Training - CPD Accredited,Acurate content for an ideal world. In the modern environment every part of the course is not possible to follow 100% to perfection even if it would the best way handle telephone calls and office tasks.,4.0,one_education
Online Nail Technician Diploma - CPD Accredited,"Don’t waste your time on this course, it’s a load of rubbish with a few dodgy videos on YouTube chucked in for good measure. Has absolutely no advice as to what tools you’ll need or where to get supplies etc. Communication with company is zero and they’ll fail you on the exam (without any guidance as to why you’ve failed...they don’t even show you what you failed on) but happily suggest you take the exam time and again ....all at additional cost to yourself!",1.0,one_education
Health and Safety Executive Training - CPD Accredited,I gave this 3 stars for value because it was discounted to £8.99 the course content most of it copy and pasted from professional sites. The parts that were written in house were very poorly written with bad grammar and context. The exam was almost incomprehensible so poorly written as to make it difficult to decipher what the question was or what answer option was relevant to the question. Over all disappointed and left me wondering why this would be credited by any body CPD?,1.6,one_education
Microsoft Access for Beginners,"This course is very hard to follow without being provided with the same template database to follow instructors instructions. Neither are any PDFs provided. One video had two audio tracks layered over each other, rendering it impossible to hear anything. The exam is based upon things the author has talked about and nothing actually useful. After all this, the company will charge £9 for a PDF certificate!",2.0,one_education
Online Nail Technician Diploma - CPD Accredited,"I cannot imagine anyone offering insurance to someone who had completed this course!!! The whole thing is littered with spelling and grammar mistakes. The content is ridiculously superficial - anyone hoping to carry out pedicures or manicures as a business would need MUCH greater understanding of the anatomy, physiology and pathology of the nail. Appalling, and not at all what i had anticipated when the course was linked to Reed !!",1.0,one_education
Sage 50 Accounting and Payroll 2018 - CPD Accredited,Very poor service,1.0,one_education
Office Skills and Administration - CPD Accredited,"Course never received. My first enquiry was answered, apparently I had given wrong email. My payment was not refunded even though I have asked several times nor course sent to 'correct' email as requested.",1.0,one_education
SEN - Special Educational Needs Teaching Assistant Diploma - CPD Accredited,I regretted paying for this course wasted money and time wont recommend this to any one. Pls save your money and get something better. The who those online reading wasn't organise well enough. Am glad it wasn't too expensive i would have been soo angry. Would never recommend buying any course from this organisation.,1.0,one_education
IT Administrator Diploma,Old videos only. Latest OP is Windows 8.,4.0,janets
Minute Taking Course - CPD Certified,,5.0,janets
Microsoft Office 2019 - CPD Accredited,Course is great. I have only recently started it but have already learnt a lot. The pace is good.,5.0,janets
"Office Admin, Secretarial and PA Diploma - CPD Certified",I'm so glad I got my course at a discount price - the content was badly written,2.3,janets
Sage 50 Payroll Complete Course - CPD Certified,brilliant,5.0,janets
Become an IT Professional (Pack of 5 Professional IT Courses) - Certificate Included,,5.0,janets
Health and Social Care Course,,5.0,janets
Diploma in Hairdressing - CPD Certified,"Amazing I couldn't believe the deal I recieved. Well worth the money. The tutorials make the course easier to understand. Brilliant job, can't wait to start a new course after this one.",4.6,janets
Become a Journalist - Master in Journalism with this 5 Courses Bundle,It's really high quality education,5.0,janets
Nursery Teacher Training with Child Psychology Course - CPD Accredited,,4.3,janets
Facilities Management Diploma - CPD Certified,"Having worked as a Retail Centre Manager and responsible for the facilities management of the site and procurement of trades, I believe this course provides valuable insights to the role and how the role is progressing from what was once considered a subservient role to one which is critical to a business and how it should be adopted at a strategic level rather than part way through any given project 'picking up the pieces'.",5.0,janets
Psychology Diploma,excellent,5.0,janets
IT Administrator Diploma,Good. Worth of money,5.0,janets
Sage 50 Payroll Complete Course - CPD Certified,,5.0,janets
Xero Accounting and Bookkeeping Course,,5.0,janets
Mental Health of Youth in Schools,It’s not clear from the description that this course is mainly about autism. Very useful for someone who has an autistic child or for if they work/want to work in this area but I probably wouldn’t have purchased this course if I knew this in the first place.,4.0,janets
Employment Law for HR Managers - CPD Accredited,good informative course,5.0,janets
Children and Adolescents Counselling Course - CPD Certified,Exceptional material and course work,5.0,janets
Diploma in Professional Chef - CPD Certified,,5.0,janets
Level 2 Certificate in Cleaning - CPD Certified,"First ever course iv had on cleaning , it has opened my eyes , loved the course, excellent.",5.0,janets
Car Maintenance Certificate Level 2 + DIY Repair Expert,need to have the final paperwork to get leave 2,5.0,janets
Therapeutic Massage Training Course for Therapists,,5.0,janets
Xero Accounting and Bookkeeping Course,,5.0,janets
Minute Taking Course - CPD Certified,A really comprehensive course. Reed Employment offers some good courses at a budget price. Looking to upskill your experience and knowledge - a great way is to choose Reed Employment course. Highly recommended.,5.0,janets
Xero Accounting and Bookkeeping Course,,4.3,janets
Child Care Essentials - CPD Certified,Quite easy to read through and I was familiar with the most of the content of the course but I have a certificate from it so I'm happy,5.0,janets
Certified Anti Money Laundering Specialist (CAMS) - CPD Certified,,2.6,janets
Xero Accounting and Bookkeeping Course,Brilliant presentation!!!! A course of full informative and effective topics on accounting and bookkeeping.,5.0,janets
Counselling & Psychotherapy Level 2 + Active Listening Diploma (Only £21),,5.0,janets
Diploma in Alternative Medicine - CPD Certified,Best,5.0,janets
British Sign Language (BSL) Level 1 & 2,I was impressed with the content and accessibility of this course. I found it useful and enjoyable.,5.0,janets
Level 3 Diploma in Child Care - CPD Certified,"To understand your child, this course is very much importantant and substantiative. Helps you to get through all the infancy process",4.3,janets
EYFS Teaching Assistant Training Course,"Hey, lovely course design!! I recommend...thanks :))))))))",4.6,janets
Health and Safety Certificate Course - CPD Certified,Good,4.0,janets
Minute Taking Course - CPD Certified,I am really enjoying this course and I am finding it very interesting.,5.0,janets
"Creative Writing Bundle Course: Drama, Comedy, Thriller, Fiction and Horror","Excellent course, I thoroughly enjoy taking part. A very well presented and delivered course.",5.0,janets
Facilities Management Diploma - CPD Certified,,5.0,janets
Level 3 Diploma in Child Care - CPD Certified,Struggled a bit initially to access the course with the help of their customer service.but the course is highly informative and I learnt a lot of new things. Recommended,4.6,janets
Sage 50 Payroll Complete Course - CPD Certified,"Having problems getting onto course, going through every thing as asked and still not getting to open content",4.0,janets
Child Care Essentials - CPD Certified,"To understand your child, this course is very much importantant and substantiative. Helps you to get through all the infancy process.",4.6,janets
Xero Accounting and Bookkeeping Course,"The Course on offer was exactly the same as several other providers namely coursegate.co,uk, as janets,org. When purchasing beware. Also the verson of Zero on the course is not the same as the free trail, and you have to search for area of the application to follow the procedure. This course needs to be re-written",1.3,janets
Family Support Worker Course,Full of information good course to develop your knowledge.,5.0,janets
Level 3 Diploma in Child Care - CPD Certified,"So much information and detailed, easy to follow and very professionally laid out, with added utube clips to follow on from content.",5.0,janets
"Microsoft Office 2016 Complete Course (Word, Excel, PowerPoint, Access & Outlook) - CPD",The informaton is invaluable. I am learning alot.,4.0,janets
Car Maintenance Course - CPD Certified,Starting my coruse next week hope it goes all week can’t wait to start it thank you,5.0,janets
Xero Accounting and Bookkeeping Course,,3.0,janets
Car Maintenance Certificate Level 2 + DIY Repair Expert,,4.6,janets
Car Maintenance Certificate Level 2 + DIY Repair Expert,Very good service. Thank you so much!!,5.0,janets
Pass Your Driving Test – Theory Course,"The title of this course is misleading. This was shown as a hugely discounted course and i expected it to be covering actual Driving THEORY. Not several [duplicated] pages of what to expect on the actual day- something which anybody could google easily - it took me less than 30 mins to complete. I feel it was mis-sold, so do not recommend.",1.0,janets
"Microsoft Office 2016 Complete Course (Word, Excel, PowerPoint, Access & Outlook) - CPD",Very good training and responsive friendly service. Totally worth the value. Really enjoyed.,5.0,janets
Car Maintenance Certificate Level 2 + DIY Repair Expert,Appalling course. The level of written language is ridiculously poor. Final 'exam' questions are not legible. Answers are marked as incorrect when they're clearly correct.,1.0,janets
Health and Social Care Level 2 + Physiotherapy Training Level 2 (Only £23),,4.3,janets
Level 2 Certificate in Cleaning - CPD Certified,I have already left a review but been asked for another. Maybe they thought I’d change my review from poor to good. Sorry but I won’t. The course is not much use if you want to work in the UK. It does not cover COSHH guidelines and much of the content is American. When completed I was directed to pay for my certificate which should have been free. Took several emails before they agreed to refund £4.99! I have recently got a cleaning job but the employer did NOT recognise this course.,2.0,janets
Minute Taking Course - CPD Certified,"This course was poorly constructed. Instead of an overview and then modules focusing on the various aspects of minute-taking; just a collection of modules which overlapped and repetition without any reference. There was little interactivity. One of the modules had questions at the end, although there were no real clues how to answer them until the next module. The quality of content was mixed. There was irrelevance, US-oriented content, OneNote instructions, spelling and formatting errors.",3.0,janets
Security Management Diploma - CPD Certified,,5.0,janets
Sage 50 Payroll Complete Course - CPD Certified,,2.3,janets
Sage 50 Payroll Complete Course - CPD Certified,Great course,5.0,janets
Bereavement and Grief Counselling Course,Good course the material is easy to read and understand,4.0,janets
Advanced Diploma in Office Administration - CPD Certified,"It’s a great course and advanced as the title. Very detailed and informative, you learn a lot specially about the bookkeeping and financial terms. The videos added are great help to understand each module. I do recommend it.",5.0,janets
Sage 50 Payroll Complete Course - CPD Certified,"I'm not happy about the sage app that came with the course. I know it's not the full app but It's supposed to work. It's locked me out quite A number of times & I can't access it completely. I tried chatting online with customer service but no response. It's not user friendly &difficult to navigate thru. However the course content is quite good but I need the app, it's not really worth doing it as it's the practical side of it that is more important ( for me at least!) I",2.0,janets
Online TEFL Course - Certificate Included,,5.0,janets
Garden Design & Landscaping Level 2 + Gardening Diploma Level 3 (Only £27),"Following receiving the e-mail and choosing the course, I found that the price was very competitive. The service from ordering to the delivery was excellent. I feel that the course material is outstanding.",5.0,janets
Diploma in Professional Chef - CPD Certified,,5.0,janets
Health and Safety Certificate Course - CPD Certified,,5.0,janets
Logistics and Supply Chain Management for Production Planner,,5.0,janets
Become a Professional Graphic Designer - 5 Courses Bundle - Special Discount Offer - £39,,3.3,janets
Diploma in Poultry Farming - CPD Certified,,4.3,janets
"Office Admin, Secretarial and PA Diploma - CPD Certified","It's a 2013 package which is not clear on purchase. There are alot of typos. I phoned the customer services to ask what does DART mean which is in Getting started, Module 5, page 27. But they didn't reply....",1.6,janets
Expert Cake Baking Course,?????,5.0,janets
Xero Accounting and Bookkeeping Course,Very poor quality course. The video tutor has clearly never worked with Xero before. I got about 20 mins in before giving up.,1.0,janets
Sage 50 Payroll Complete Course - CPD Certified,Rubbish,1.6,janets
Office Skills and Receptionist Course - CPD Certified,Easy to use and content good,4.0,janets
Supply Chain Management Diploma + Level 2 Certificate in Purchasing and Procurement,,5.0,janets
Massage Therapist Course - CPD Certified,Fantastic course full of all the information you need to be involved in this field. Due to the range of exam questions you cannot pass this unless you have fully read and understood the course. Very happy to say I passed and my certificate was delivered within a week.,5.0,janets
Become a Computer Maintenance Specialist - 7 Computer Maintenance Course Bundle,"I subscribed to this course to get up-to-date with computers/computing having studied it 30 years ago. Sadly the course content so far is quite dated referring to Cathode Ray Tube (CRT) monitors, PDAs (some of which can be used to make cellular calls!) and no mention of smart phones or SSD storage. Makes me concerned whether I actually getting up to date across any of the course content or just catching up to 15 years ago!",3.3,janets
Property Development and Management Course,Fantastic and a massive building block for any successful persons to attain. ?? worth it.,5.0,janets
Become an IT Professional (Pack of 5 Professional IT Courses) - Certificate Included,"I'm requesting a refund. I bought the course in one day, the next day I saw that the site does not exist terms and conditions, I canceled and requested the money back. But they are refusing to give it back. I did not take the course or the money back. I have 14 days to ask for the money back, I did the next day and they denied it. no one answers, no site and no conditions. It is not reliable. I hope I do not waste my time and money on this. never buy on reed again.",1.0,janets
Advanced Diploma in Real Estate,Great course to be a practical realtor,5.0,janets
Complete Photography Course - 5 Photography Courses in 1 with Certificate,,5.0,janets
British Sign Language (BSL) Level 1 & 2,"Probably the best sign language course, it's very well organised and the instructor explanation is very easy to understand. The price is right for the quality of course you get. I learned a lot after starting the course. Would definitely recommend this course to anyone who is interested in learning British sign language.",5.0,janets
Child Psychology Level 5 Advanced Diploma + Advanced Diploma in Child Care,Very excited for this journey l just started. Thank you. You bit education. Education ls power,5.0,course_gate
